{
  "schemaVersion": 1,
  "id": "promptpad-experts",
  "version": "1.0.0",
  "prompts": [
    {
      "id": "builtin:product-requirements:zh-CN",
      "title": "产品需求",
      "content": "**适用：** 用户需要定义新功能、整理模糊需求、比较方案或制定验收标准。已有明确规格且只需执行时，不重复做需求讨论。\n\n**先确认：** 目标用户、要解决的问题、当前流程、成功信号、必须遵守的限制。能从现有产品或材料读出的事实先查证；缺失而影响范围的选择再向用户询问。\n\n**工作方法：**\n1. 用一句话写出用户问题，区分用户诉求和猜测的解决方案。\n2. 列出关键使用场景及失败场景，并按用户价值与实现成本排序。\n3. 明确首版包含什么、暂缓什么；每个功能都对应可观察的结果。\n4. 写出与设计、工程有关的依赖和仍需决定的取舍；不要伪造市场数据。\n\n**交付：** 简短目标、主要用户流程、优先级、范围边界、可验收条件和未决问题。验收条件应描述用户可看到的行为，不只写“功能正常”。\n",
      "tags": [
        "product",
        "product-requirements"
      ],
      "variables": [],
      "favorite": false,
      "pinned": false,
      "createdAt": "2026-10-20T00:00:00Z",
      "updatedAt": "2026-10-20T00:00:00Z",
      "origin": "builtin",
      "expertKey": "product-requirements",
      "locale": "zh-CN",
      "domain": "product",
      "description": "用户需要定义新功能、整理模糊需求、比较方案或制定验收标准。已有明确规格且只需执行时，不重复做需求讨论。",
      "useWhen": "用户需要定义新功能、整理模糊需求、比较方案或制定验收标准。已有明确规格且只需执行时，不重复做需求讨论。",
      "packageId": "promptpad-experts",
      "contentVersion": "1.0.0",
      "contentHash": "7617b21dfff3a9dad3222f6a848cb761429a7f105babae426402fdcf720ec9da",
      "sourcePath": "skills/promptpad-experts/references/product-requirements.md",
      "sourceCommit": "42ffbc07251268f038246771f790f31fa97849fc"
    },
    {
      "id": "builtin:product-requirements:en",
      "title": "Product requirements",
      "content": "**Use for:** Defining a feature, resolving ambiguous requirements, comparing options, or writing acceptance criteria. If a clear specification exists and the task is execution, do not reopen discovery.\n\n**Establish:** Target users, their problem, current workflow, success signals, and hard constraints. Verify facts available from the product or supplied materials before asking for missing product choices.\n\n**Method:**\n1. State the user problem in one sentence; separate the need from a proposed solution.\n2. Map main and failure scenarios, then prioritize by user value and implementation cost.\n3. Define what the first release includes and defers; tie each feature to an observable outcome.\n4. Note design and engineering dependencies and unresolved tradeoffs; do not invent market evidence.\n\n**Deliver:** A concise goal, primary flow, priorities, boundaries, testable acceptance criteria, and open decisions. Criteria should describe visible user behavior rather than merely say “works.”\n",
      "tags": [
        "product",
        "product-requirements"
      ],
      "variables": [],
      "favorite": false,
      "pinned": false,
      "createdAt": "2026-10-20T00:00:00Z",
      "updatedAt": "2026-10-20T00:00:00Z",
      "origin": "builtin",
      "expertKey": "product-requirements",
      "locale": "en",
      "domain": "product",
      "description": "Defining a feature, resolving ambiguous requirements, comparing options, or writing acceptance criteria. If a clear specification exists and the task is execution, do not reopen discovery.",
      "useWhen": "Defining a feature, resolving ambiguous requirements, comparing options, or writing acceptance criteria. If a clear specification exists and the task is execution, do not reopen discovery.",
      "packageId": "promptpad-experts",
      "contentVersion": "1.0.0",
      "contentHash": "f7bb2e0d119a82a0ce6ee5ff7f122ae233af2802935f6ac638b9e7d9d8c2809a",
      "sourcePath": "skills/promptpad-experts/references/product-requirements.md",
      "sourceCommit": "42ffbc07251268f038246771f790f31fa97849fc"
    },
    {
      "id": "builtin:software-architecture:zh-CN",
      "title": "软件架构",
      "content": "**适用：** 需要设计模块边界、数据流、接口、存储或部署方案。小范围代码修改通常先遵循现有架构。\n\n**先确认：** 当前代码结构、运行环境、负载与数据规模、兼容要求、团队维护能力。区分已知约束与待验证假设。\n\n**工作方法：**\n1. 画出主要组件及数据在组件间的流动，指出状态由谁持有。\n2. 为每个边界说明输入、输出、错误与权限；只引入需求确实需要的新组件。\n3. 比较至多两三个可行方案，围绕复杂度、可靠性、成本和演进性说明取舍。\n4. 检查失败恢复、数据迁移、可观测性和运行时限制；给出可逐步落地的顺序。\n\n**交付：** 推荐架构、关键接口和数据流、主要取舍、失败处理、迁移步骤和验证方法。不把未测量的性能收益写成事实。\n",
      "tags": [
        "software",
        "software-architecture"
      ],
      "variables": [],
      "favorite": false,
      "pinned": false,
      "createdAt": "2026-10-20T00:00:00Z",
      "updatedAt": "2026-10-20T00:00:00Z",
      "origin": "builtin",
      "expertKey": "software-architecture",
      "locale": "zh-CN",
      "domain": "software",
      "description": "需要设计模块边界、数据流、接口、存储或部署方案。小范围代码修改通常先遵循现有架构。",
      "useWhen": "需要设计模块边界、数据流、接口、存储或部署方案。小范围代码修改通常先遵循现有架构。",
      "packageId": "promptpad-experts",
      "contentVersion": "1.0.0",
      "contentHash": "4c748ae777d362bdefe12eb504cf6ed436f5ebe0d68cca50c9d5f27bf6a90eec",
      "sourcePath": "skills/promptpad-experts/references/software-architecture.md",
      "sourceCommit": "42ffbc07251268f038246771f790f31fa97849fc"
    },
    {
      "id": "builtin:software-architecture:en",
      "title": "Software architecture",
      "content": "**Use for:** Designing module boundaries, data flow, interfaces, storage, or deployment. For a small code change, prefer the existing architecture.\n\n**Establish:** Current code structure, runtime, expected scale, compatibility needs, and maintenance capacity. Separate known constraints from assumptions to verify.\n\n**Method:**\n1. Map the main components and data movement; identify the owner of each state.\n2. Define inputs, outputs, errors, and permissions at each boundary. Add components only when justified by a requirement.\n3. Compare a small number of viable options by complexity, reliability, cost, and ease of change.\n4. Address failure recovery, migration, observability, and runtime limits; sequence incremental implementation.\n\n**Deliver:** Recommended architecture, key interfaces and flows, tradeoffs, failure handling, migration steps, and validation. Do not present unmeasured performance gains as fact.\n",
      "tags": [
        "software",
        "software-architecture"
      ],
      "variables": [],
      "favorite": false,
      "pinned": false,
      "createdAt": "2026-10-20T00:00:00Z",
      "updatedAt": "2026-10-20T00:00:00Z",
      "origin": "builtin",
      "expertKey": "software-architecture",
      "locale": "en",
      "domain": "software",
      "description": "Designing module boundaries, data flow, interfaces, storage, or deployment. For a small code change, prefer the existing architecture.",
      "useWhen": "Designing module boundaries, data flow, interfaces, storage, or deployment. For a small code change, prefer the existing architecture.",
      "packageId": "promptpad-experts",
      "contentVersion": "1.0.0",
      "contentHash": "47581fdfad47d1a29b7c537093357bfda200f4b3903c43e2b4ff8c625b632939",
      "sourcePath": "skills/promptpad-experts/references/software-architecture.md",
      "sourceCommit": "42ffbc07251268f038246771f790f31fa97849fc"
    },
    {
      "id": "builtin:debugging:zh-CN",
      "title": "故障排查",
      "content": "**适用：** 出现可观察的错误、崩溃、行为偏差或间歇故障。不要在缺少证据时把猜测当根因。\n\n**先确认：** 预期与实际行为、最小复现步骤、首次出现时间、环境和最近变更。优先读取现有日志、错误信息和相关代码。\n\n**工作方法：**\n1. 复现问题并界定影响范围；无法复现时记录条件与缺失证据。\n2. 按数据流定位最早出现偏差的位置，一次只改变一个变量。\n3. 用日志、断点或小实验验证最可能的根因，区分症状与原因。\n4. 实施最小修复，检查相邻边界与回归风险，并验证原始复现路径。\n\n**交付：** 复现结果、证据、根因或仍待验证的假设、修复说明、验证结果。运行失败或未执行的检查必须如实写出。\n",
      "tags": [
        "software",
        "debugging"
      ],
      "variables": [],
      "favorite": false,
      "pinned": false,
      "createdAt": "2026-10-20T00:00:00Z",
      "updatedAt": "2026-10-20T00:00:00Z",
      "origin": "builtin",
      "expertKey": "debugging",
      "locale": "zh-CN",
      "domain": "software",
      "description": "出现可观察的错误、崩溃、行为偏差或间歇故障。不要在缺少证据时把猜测当根因。",
      "useWhen": "出现可观察的错误、崩溃、行为偏差或间歇故障。不要在缺少证据时把猜测当根因。",
      "packageId": "promptpad-experts",
      "contentVersion": "1.0.0",
      "contentHash": "8524cef626c4744f3f2d625c2694137169545a7f543dfb7ad1d118e3fcd9f4b3",
      "sourcePath": "skills/promptpad-experts/references/debugging.md",
      "sourceCommit": "42ffbc07251268f038246771f790f31fa97849fc"
    },
    {
      "id": "builtin:debugging:en",
      "title": "Debugging",
      "content": "**Use for:** Observable errors, crashes, incorrect behavior, or intermittent failures. Do not label a guess as the root cause without evidence.\n\n**Establish:** Expected versus actual behavior, minimal reproduction, first occurrence, environment, and recent changes. Read existing errors, logs, and relevant code first.\n\n**Method:**\n1. Reproduce and bound the impact; if reproduction fails, record the conditions and missing evidence.\n2. Trace the data flow to the earliest divergence, changing one variable at a time.\n3. Confirm the most likely cause with logs, a debugger, or a focused experiment; distinguish symptoms from causes.\n4. Apply the smallest fix, inspect adjacent boundaries and regression risks, then rerun the original reproduction.\n\n**Deliver:** Reproduction status, evidence, confirmed cause or open hypothesis, fix, and verification. State plainly when checks failed or were not run.\n",
      "tags": [
        "software",
        "debugging"
      ],
      "variables": [],
      "favorite": false,
      "pinned": false,
      "createdAt": "2026-10-20T00:00:00Z",
      "updatedAt": "2026-10-20T00:00:00Z",
      "origin": "builtin",
      "expertKey": "debugging",
      "locale": "en",
      "domain": "software",
      "description": "Observable errors, crashes, incorrect behavior, or intermittent failures. Do not label a guess as the root cause without evidence.",
      "useWhen": "Observable errors, crashes, incorrect behavior, or intermittent failures. Do not label a guess as the root cause without evidence.",
      "packageId": "promptpad-experts",
      "contentVersion": "1.0.0",
      "contentHash": "a42363297f51077ce45598d1092db20faecbdfa7883a208883c3246c9f6a0d99",
      "sourcePath": "skills/promptpad-experts/references/debugging.md",
      "sourceCommit": "42ffbc07251268f038246771f790f31fa97849fc"
    },
    {
      "id": "builtin:react-performance:zh-CN",